{
 "version": "v1",
 "angle": "Parti pris « le puzzle de ton patrimoine » : on part du seul chiffre que « Toi » regarde, la pilule cyan « 3 200 € » de son solde, et on montre qu’elle n’est qu’une case sur neuf d’une grille dont les huit autres cases sont des « ? ». La même grille devient « ce que tu possèdes » dans l’équation « grille − carte grise de la banque = Patrimoine net », se remplit case par case au point 1, prête sa case « Immobilier » (un jeton-maison de verre) au point 2, où la barre de valeur de l’appartement perd sa part grise (180 000 €) pour ne garder que ≈ 70 000 € nets, puis fournit au point 3 les pastilles qui montrent ce que le chiffre mélange. Dans la chute, « Toi » ne regarde plus son solde mais le Patrimoine net. Les trois angles combinés : objets persistants (la pilule « 3 200 € » de la première image au bouton ; la grille née dans l’accroche et présente jusqu’à la fin ; la carte grise « Ce que tu dois » qui se range dans le disque 2 du repère, en ressort en part grise de la barre, y retourne, puis revient dans l’équation finale ; la pilule « Patrimoine net » rangée dans le disque 3, qui en ressort au point 3 et devient le résultat de la chute ; l’en-tête « Ce que tu possèdes » devenu la légende 1 du repère ; les pastilles qui sortent des cases ; le point « repère » qui tombe de la pilule et commence la courbe) ; grammaire de la référence (cartes, pilules, une barre, des points et une courbe ; tenir puis éclater ; 1 à 3 éléments actifs par temps fort ; deux PNG seulement, un à la fois) ; lisibilité sans le son (verbes francs : regarder, remplir, barrer, poser, recouvrir, détacher, retirer, compter, sortir, relier, tracer). Procédés repris de V01-V12 : pilule du solde qui devient le bouton (V04, V12), trait de regard en tirets de « Toi » (V12), repère légendé avec étapes cochées et légendes à l’encre (V02-V03, doneStyle « kept »), valeur barrée qui tombe (V01), relais par morph, fin standard sans curseur de souris (V12).\nRéponse aux 7 points :\n1) Fil conducteur : la pilule « 3 200 € » de ton solde, regardée seule par « Toi » (S01), réduite à une case sur neuf (S02), première case de « ce que tu possèdes » (S04-S09), toujours dans sa case pendant le calcul (S10-S19), regardée en rouge puis délaissée pour le Patrimoine net (S20-S21), devenue le bouton « S’abonner » (S22).\n2) État initial / action / résultat : chaque scène part du résultat de la précédente et finit sur un changement visible : la grille de « ? » se remplit (S08-S09), « Prix d’achat » est barré et remplacé (S10), la barre de 250 000 € perd sa part grise et il reste ≈ 70 000 € nets (S11-S15), le chiffre se décompose en pastilles (S17), une courbe naît d’un point (S18-S19), le regard de « Toi » change de cible (S20-S21).\n3) Le sens complet : « ne dit presque rien » = une case connue sur neuf ; « pas à toi en entier » = la carte de la banque recouvre 72 % de la barre ; « pas les mensualités, mais le montant restant » = une petite tranche rouge barrée, puis toute la part grise sous une accolade ; « pas 250 000 € mais environ 70 000 € nets » = la barre entière cernée de rouge, puis la part grise retirée et le reste chiffré ; « mélange » = six pastilles opposées deux à deux ; « son évolution qui compte » = 8 points, 2 par an, et une courbe qui monte.\n4) L’IA ≠ « Toi » : pas d’IA dans ce film (AI.png non utilisé, aucun pointillé d’IA) ; « Toi », figurine encre nommée par sa pilule dès la première image, bras baissé au repos, est le seul à tenir le stylo : il écrit le Patrimoine net, barre « Prix d’achat » et « Mensualité », retire la part grise, déclenche les points de la courbe, barre son propre regard vers le solde.\n5) Les mêmes éléments évoluent : carte « Solde » → case « Comptes » ; cases « ? » → cases nommées ; en-tête → légende 1 du repère ; carte grise « Ce que tu dois » → disque 2 → part grise « Capital restant dû · 180 000 € » → disque 2 → carte de l’équation finale ; pilule « Patrimoine net » → disque 3 → « ce chiffre » du point 3 → résultat de la chute ; jeton-maison : case « Immobilier » → objet de l’exemple → retour dans sa case ; pastilles nées des cases ; point « repère » né de la pilule → premier point de la courbe.\n6) PNG au service de la scène : TOKEN.png est l’appartement (dans sa case, puis sujet de l’exemple, il reçoit l’étiquette, la barre et ses montants dessinés en code) ; TARGET.png reçoit la flèche « point de départ » (S05). Tout processus est en code : remplissage, barre, retrait, compteurs, pastilles, courbe. Aucun zoom sur un PNG.\n7) Simplicité : ivoire quadrillé, encre, un seul accent cyan (pilule du solde, part « à toi » de la barre, disque actif, points de la courbe), gris seulement pour la part de la banque, rouge seulement pour quatre erreurs suivies de leur parade ; Inter, libellés clés en 34 px et plus ; 1 à 3 éléments actifs par temps fort.",
 "thread": "On suit la pilule cyan « 3 200 € », le solde de « Toi », sur sa carte « Solde » : c’est le seul chiffre qu’il regarde (S01). Elle se réduit à une case d’une grille de neuf dont les huit autres sont des « ? » (S02) ; la grille devient « ce que tu possèdes » dans l’équation grille − « Ce que tu dois » = « Patrimoine net » (S03-S05), puis se remplit case par case au point 1 : comptes, livrets, assurance-vie, PEA, épargne salariale, PER, immobilier, véhicule, parts de société, chacun à sa valeur actuelle (S06-S10). Au point 2, le jeton-maison de la case « Immobilier » sort ; sa barre de valeur est recouverte aux trois quarts par la carte grise de la banque, « Toi » retire ce capital restant dû (pas une mensualité) et il reste ≈ 70 000 € nets sur 250 000 € (S11-S15). Au point 3, la pilule « Patrimoine net » revient avec un signe d’attention : six pastilles nées des cases montrent ce qu’elle mélange, deux restent à côté d’elle (liquidité, risques) et un point « repère » tombé d’elle commence une courbe qui monte à raison de 1 ou 2 mesures par an (S16-S19). Dans la chute, le regard de « Toi » vers son solde vire au rouge et il le barre ; il regarde désormais le Patrimoine net de l’équation complète, légendée « Possèdes », « Dois », « Limites », et la pilule du solde, restée dans sa case, devient le bouton « S’abonner » (S20-S22).",
 "objet_fil": {
  "id": "solde",
  "description": "La pilule cyan « 3 200 € » (320×100 en S01, contour encre 4 px, ombre dure, Inter ExtraBold 60) : le solde bancaire de « Toi ». Posée sur la carte « Solde » dès l’image 0, regardée par « Toi » (S01) ; réduite avec sa carte en première case d’une grille de neuf, dont les huit autres sont des « ? » (S02) ; elle bat sur « solde » (S07) et sa carte devient la case « Comptes » (S08) ; elle reste dans cette case, à l’échelle de la grille, pendant tout le calcul (S03-S19), donne naissance aux pastilles « disponible » et « réel » (S17) ; dans la chute elle sort de sa case vers « Toi », son regard vire au rouge et il le barre, puis elle rentre dans sa case (S20-S21) ; elle ne change jamais de chiffre et devient le bouton « S’abonner » de la carte de fin (S22)."
 },
 "cast": [
  {
   "id": "solde",
   "name_fr": "Pilule du solde (objet du fil)",
   "look": "Pilule cyan #19B3C7, contour encre 4 px, ombre dure +6/+6, texte encre Inter ExtraBold « 3 200 € » (espaces insécables) : 320×100, corps 60, en (540, 690) sur la carte « Solde » en S01 ; 198×62, corps 37, dans la case « Comptes » de la grille pleine (195, 535) ; ×0,6 (119×37, corps 22) dans la grille réduite (135, 489) ; 256×80, corps 48, quand elle sort vers « Toi » en (420, 1140) (S20). Jamais d’autre chiffre.",
   "source": "code",
   "entite": "pill (pistes scale, text pour la fin) ; kit.pulse ; kit.move ; kit.outro (btn_at : devient le bouton)",
   "evolution": "S01 : seule à l’écran avec sa carte, regardée par « Toi », bat sur « solde ». S02 : se réduit avec sa carte en première case d’une grille de neuf. S03-S05 : dans la grille réduite, première case de « ce que tu possèdes ». S07 : bat ; sa case s’éclaire (la seule connue). S08 : sa carte devient la case « Comptes ». S10-S19 : reste dans sa case (grille pleine puis réduite) ; S17 : les pastilles « disponible » et « réel » sortent d’elle. S20 : sort de sa case vers « Toi », qui la regarde, regard qui vire au rouge. S21 : rentre dans sa case. S22 : devient le bouton « S’abonner »."
  },
  {
   "id": "compte",
   "name_fr": "Carte « Solde » / case « Comptes »",
   "look": "Carte papier #FFFDF8 440×300, rayon 18, contour encre 4, ombre +6/+6, centre (540, 640) (x 320-760, y 490-790) ; en-tête : pictogramme bank encre 40 px en (380, 545) puis « Solde » Inter Bold 40 encre (anchor start, 412, 558) ; filet rule #E6DECF en y 590 (x 336-744). Devenue case : 250×180 en (195, 510), pictogramme bank 30 px en (110, 450) et « Solde » puis « Comptes » Bold 34 (anchor start, 135, 462), pilule du solde en (195, 535) ; fond light #D3F0F6 et contour deep pendant S07 seulement.",
   "source": "code",
   "entite": "shape round (pistes w, h, fill, stroke) + icon bank + text (pistes text, chars) + shape rect (filet)",
   "evolution": "S01 : carte d’appli bancaire au centre. S02 : se réduit en première case de la grille. S07 : s’éclaire (fond light, contour deep) : c’est la seule case connue. S08 : repasse au papier, « Solde » devient « Comptes ». S11-S21 : à l’échelle 0,6 avec la grille. S22 : se réduit avec la grille."
  },
  {
   "id": "toi",
   "name_fr": "« Toi » (le spectateur)",
   "look": "Figurine pleine encre #1E1416 (tête ronde, buste trapèze, bras à longueur fixe, stylo), ombre dure +6/+6, échelle 1, pied sur y 1230 ; pilule light « Toi » (100×56, Inter Bold 34 encre, contour encre 3, ombre +4) qui le suit : au-dessus de sa tête en P1 (850, 995), à droite de sa tête en P2 et P3 (x + 100, 1060). Places : P1 (850, 1135) au repos, bras baissé ; P2 (700, 1135) ; P3 (560, 1135). Atteinte du stylo vérifiée par fig.place_for (rien de ce qu’il touche au-dessus de y ≈ 850).",
   "source": "code",